{"currentGate":null,"finalReview":null,"history":[{"planDigest":"51793f04cd0d136f3e48cbc4ab12779b24d135a61deee765f83d49c3a4246f07","planRevision":1,"recordedAt":"2026-08-10T10:22:49.787Z","type":"plan_synced"},{"checkpointId":"PR38-JOINT-REVIEW","invocationKey":"0ff9420348f2b89807646804d8b8fe406a372ccdc98d22fa11dd3b75039fe8e2","recordedAt":"2026-08-10T10:30:02.957Z","triggerType":"DRIFT_REVIEW","type":"product_manager_review","verdict":"needs_user_decision"},{"checkpointId":"PR38-JOINT-REVIEW","invocationKey":"0ff9420348f2b89807646804d8b8fe406a372ccdc98d22fa11dd3b75039fe8e2","presentationDigest":"ba901ab75b672160e8b8796b7c8f55c4a069d98bcb0ab3fd763fa021dc3c1734","recordedAt":"2026-08-10T10:30:11.070Z","type":"product_manager_advice_presented"},{"checkpointId":"PR38-JOINT-REVIEW","decision":"rejected","reason":"先重跑 Antigravity；若这一次仍失败，报告它实际配置的默认模型。","recordedAt":"2026-08-10T10:37:35.178Z","type":"user_response"}],"latestAdvice":{"checkpointId":"PR38-JOINT-REVIEW","evidenceRefs":["pr:38","base:66da1493327b4905c4c2180f7056d8f30e8796b8","head:7f8531a6ab6f76618eaba9f24e9c984f32a186a5","diff-sha256:e0b659dcc7bb60c1f20f4c146608c4d47b557f8b2d81be73db5d62cfdec39017","github-ci:10/10",".trellis/tasks/08-10-review-pr-38-four-provider/prd.md",".trellis/tasks/08-10-review-pr-38-four-provider/design.md",".trellis/tasks/08-10-review-pr-38-four-provider/implement.md",".trellis/tasks/08-10-review-pr-38-four-provider/product-manager.json",".trellis/tasks/08-10-review-pr-38-four-provider/task.json",".trellis/tasks/08-09-simplify-gptpro-url-first-recovery/prd.md",".trellis/tasks/08-09-simplify-gptpro-url-first-recovery/implement.md",".trellis/tasks/08-09-simplify-gptpro-url-first-recovery/product-manager.json",".trellis/spec/tooling/chatgpt-pro-agent-browser-v2.md","components/ccg-workflow/templates/engine/tools/gptpro/gptpro_bridge.py","scripts/lib/harness-adapter/conflict-static.mjs",".harness/adapter.json","harness.sources.json",".gitignore","snapshot:8a54abb8-ed04-496f-9a4c-d90ae5f47df7"],"findings":[{"category":"evidence-binding","evidence_refs":[".trellis/tasks/08-10-review-pr-38-four-provider/design.md:30-33",".trellis/tasks/08-10-review-pr-38-four-provider/prd.md:17-20","snapshot:8a54abb8-ed04-496f-9a4c-d90ae5f47df7/root"],"id":"F1","recommendation":"重建快照并把 .ccg-evidence/review/review-manifest.json、pr-38.diff、test-summary.md 纳入 include 规则后重跑 Claude 路；在此之前联合状态记为 incomplete。","severity":"blocker","summary":"design.md §3 要求 product-manager 快照含 shared manifest、受限 diff 与测试摘要，实际快照中三者均不存在，Claude 路无法证明与其余三路绑定同一 base/head/diff SHA-256。","title":"Claude 路快照未包含受限 diff 与 shared manifest，违反 R1/R2 与 AC1"},{"category":"review-coverage","evidence_refs":[".trellis/tasks/08-09-simplify-gptpro-url-first-recovery/implement.md:96-102",".trellis/tasks/08-10-review-pr-38-four-provider/prd.md:29-32","snapshot:8a54abb8-ed04-496f-9a4c-d90ae5f47df7/root"],"id":"F2","recommendation":"把 PR diff 命中的 adapter/watcher/Pester 文件按只读方式纳入快照；Codex 不得把本次 Claude 输出当作对这些文件的有效审查记录。","severity":"blocker","summary":"父任务把 chatgpt-pro-sidebar.ps1、chatgpt-pro-sidebar-watch.ps1 与两个 Pester 文件列为风险文件，但快照中不含 .agents 目录，Claude 路对 URL-first 绑定、一次安全重试、两次点击上限、7200 秒绝对截止和严格 Pro 门槛无法给出 file:line 证据。","title":"主要改动面 .agents/skills/chatgpt-pro-sidebar/** 不在快照内，R3 覆盖无法完成"},{"category":"acceptance-gap","evidence_refs":[".trellis/tasks/08-09-simplify-gptpro-url-first-recovery/prd.md:78",".trellis/tasks/08-09-simplify-gptpro-url-first-recovery/implement.md:73-84","github-ci:10/10"],"id":"F3","recommendation":"在 AC11 三条 live 路径与用户焦点确认完成前保持 Draft，不给出建议合并结论。","severity":"major","summary":"implement.md 中 live E2E 的六项子条目、responseQuality 取证与焦点确认均未勾选，M2 source-evidence 与 M2 product-manager review 亦未完成；GitHub CI 10/10 只覆盖离线门禁。","title":"父任务 AC11 真实 Chrome E2E 未完成，PR #38 不具备合并验收条件"},{"category":"ledger-drift","evidence_refs":[".trellis/tasks/08-09-simplify-gptpro-url-first-recovery/product-manager.json",".trellis/tasks/08-09-simplify-gptpro-url-first-recovery/implement.md:49-84"],"id":"F4","recommendation":"补齐 research/product-manager-m2-source-evidence.json 并触发 M2 MILESTONE_REVIEW，让台账成为唯一验收权威；不要用计划复选框代替验收。","severity":"major","summary":"product-manager.json 记录 M2=not_started、implementation=45、health=yellow、reasons=[drift]，而 implement.md 中 M2 绝大多数条目已勾选；同时 M1 的 reviewStale=true。","title":"父任务台账与计划文件对 M2 状态不一致"},{"category":"test-evidence","evidence_refs":[".trellis/tasks/08-09-simplify-gptpro-url-first-recovery/implement.md:61-64"],"id":"F5","recommendation":"在最终报告中如实标注该门禁为单份全绿 + 一次超时未完成，不要在汇总时四舍五入为\"全绿\"。","severity":"minor","summary":"implement.md 自述只有受支持的 3.4.8 更新事务达成 452 passed / 0 failed / 3 skipped，当前主工作树复跑因进程启动与 hard-kill 标记等待超时未完成，该差异需在合并结论中显式保留。","title":"当前主工作树 pnpm harness:test 无第二份全绿终态"},{"category":"contract-conformance","evidence_refs":["components/ccg-workflow/templates/engine/tools/gptpro/gptpro_bridge.py:2184-2193","scripts/lib/harness-adapter/conflict-static.mjs:310-313",".harness/adapter.json:151-154",".trellis/spec/tooling/chatgpt-pro-agent-browser-v2.md:237-239"],"id":"F6","recommendation":"可作为 bridge import 与来源同步维度的正向证据计入联合报告，但不足以覆盖 adapter/watcher 维度。","severity":"info","summary":"gptpro_bridge.py 的 importer 拒绝非 completed 的 terminalOutcome 并强制 requiresCodexReview=true / automaticResendAllowed=false；conflict-static.mjs 与 adapter.json 的 transport/continuation 声明一致，符合规范 Required checks。","title":"快照内可核验部分与 V2 规范一致"}],"generatedAt":"2026-08-10T10:42:00Z","invocationKey":"0ff9420348f2b89807646804d8b8fe406a372ccdc98d22fa11dd3b75039fe8e2","planRevision":1,"presentedAt":"2026-08-10T10:30:11.070Z","processAdjustments":[{"id":"PA1","rationale":"本次 .agents 与 review bundle 被静默排除，导致只读路在不知情的情况下可能产出看似有效实则未覆盖主改动面的报告。","statement":"task-local product-manager 快照的 include 规则必须由本次审查的\"目标文件清单\"驱动，而不是默认顶层目录白名单；缺失任一目标文件时应在快照 manifest 中显式标注，而非静默省略。"},{"id":"PA2","rationale":"落实 R1/AC1，避免不同路在不同 head 上审查后被混合汇总。","statement":"四路联合审查应在每路输出中强制携带 base/head/diff-sha256 三元组，Codex 汇总时先做三元组一致性校验再看 finding 内容。"},{"id":"PA3","rationale":"父任务当前出现 M2 已大量勾选但台账 not_started 的漂移，容易造成验收被高估。","statement":"验收百分比一律以 product-manager.json 台账为准，implement.md 复选框只作为工程进度记录；两者漂移时先补 MILESTONE_REVIEW 再更新台账。"},{"id":"PA4","rationale":"父任务 implement.md 已如实区分，汇总环节需保持同样精度以免误导合并决策。","statement":"测试门禁摘要必须区分\"受支持事务的全绿\"与\"当前工作树复跑未完成\"，禁止合并为单一\"全绿\"表述。"}],"productManagerStatement":"结论：本次 Claude 产品经理只读路无法给出\\\"可合并\\\"的验收意见，需要你决定是否按修正后的快照重跑。原因有两条硬性的：一是收到的只读快照里没有 pr-38.diff、review-manifest.json 和 test-summary.md，Claude 路因此无法证明自己和 Antigravity、Grok、GPT Pro 审的是同一个 base/head/diff（违反 PRD R1 与 AC1）；二是快照里根本没有 .agents/skills/chatgpt-pro-sidebar/ 下的 adapter、watcher 和两个 Pester 文件——那正是父任务自己列出的风险文件，也是 URL-first 绑定、一次安全重试、两次点击上限、7200 秒绝对截止和严格 Pro 门槛的所在，所以 R3 要求的覆盖在本路没有完成。按 R5/AC4，任一路证据无效就必须记为 incomplete 且不得建议合并。快照里能核验的部分是正向的：CCG bridge importer 确实拒绝非 completed 的 terminalOutcome 并强制 requiresCodexReview=true、automaticResendAllowed=false；harness conflicts 的 transport=agent-browser-cli-v2 与 continuation=codex-root-wait 合同和 adapter.json 一致。但这只覆盖 bridge import 与来源同步两个维度。另外，即便四路证据补齐，PR #38 目前也不满足合并验收：父任务 AC11 的真实 Chrome E2E 三条路径、responseQuality 取证和焦点确认都还没勾，M2 的 source-evidence 与 product-manager review 也未完成，台账仍是 implementation=45 / productAcceptance=45 / health=yellow / M2=not_started；且 pnpm harness:test 只有受支持事务的一份全绿，当前主工作树复跑超时未形成第二份全绿，这个区分不要在汇总时被抹平。建议：先按 MCP1 修快照 include 规则再重跑 Claude 路，同时推进 AC11 与 M2 复审；在此之前 PR 保持 Draft，联合报告写 incomplete，不出合并建议。本路全程只读，未改动任何产品代码、PR 状态或你的 pnpm-lock.yaml。","providerIdentity":{"cli_version":"2.1.220 (Claude Code)","model":"opus","provider":"claude"},"recommendedNextAction":"先修正 product-manager 快照构建规则：把 .ccg-evidence/review/review-manifest.json、pr-38.diff、test-summary.md 与 PR diff 命中的 .agents/skills/chatgpt-pro-sidebar/**（adapter、watcher、两个 Pester 文件）以只读方式纳入，然后重跑 Claude 路；在此之前把 Claude 路记为 incomplete-input，联合审查状态保持 incomplete，不给出建议合并结论。并行推进父任务 AC11 的三条真实 Chrome E2E 与 M2 product-manager review，以闭合合并前的验收缺口。","risks":[{"id":"R1","mitigation":"在联合报告中把 Claude 路状态记为 incomplete-input，明确其未覆盖 adapter/watcher 文件，并在快照修正后重跑。","severity":"high","statement":"若 Codex 把本次 Claude 输出直接计为\"有效 product-manager 投影\"，将在四路证据实际缺口下产生虚假的 AC2 满足，进而可能给出不成立的合并建议。"},{"id":"R2","mitigation":"保持 Draft，直到三条 live 路径、responseQuality 取证与用户焦点确认全部完成并写入 evidence。","severity":"high","statement":"父任务 AC11 live E2E 未完成即合并，会把 URL-first 绑定、一次安全重试与第二次超时通知的真实浏览器行为风险直接带入用户环境，单测 mock 可能掩盖焦点与页面真实行为。"},{"id":"R3","mitigation":"以 product-manager.json 为唯一验收权威，先补 M2 source-evidence 再触发 MILESTONE_REVIEW。","severity":"medium","statement":"台账与计划文件的 M2 状态漂移可能导致按 implement.md 复选框而非 product-manager 台账判断验收，绕过 M2 独立复审。"},{"id":"R4","mitigation":"每路证据落盘时记录 head，与 7f8531a6 逐一比对，不一致即整体重建绑定。","severity":"medium","statement":"PR head 若在四路审查期间变动，全部已收集证据按 design.md §5 作废，可能出现部分路使用旧 head 的混合证据。"},{"id":"R5","mitigation":"在快照 include 规则与提交前检查中显式排除该文件，并在最终报告中确认其未改变。","severity":"low","statement":"用户未跟踪的 pnpm-lock.yaml 若被误纳入 provider 输入或任务提交，将违反 R1 与 AC5。"}],"triggerType":"DRIFT_REVIEW","verdict":"needs_user_decision"},"milestones":[{"evidenceGap":false,"evidenceRefs":[],"id":"M1","majorRisk":false,"pmReview":null,"pmVerdict":null,"reviewStale":false,"status":"not_started","title":"Final user deliverable","userAcceptance":null,"weight":100}],"nextAction":"Remediate PR38-JOINT-REVIEW: 先重跑 Antigravity；若这一次仍失败，报告它实际配置的默认模型。","planDigest":"51793f04cd0d136f3e48cbc4ab12779b24d135a61deee765f83d49c3a4246f07","planRevision":1,"progress":{"health":"green","implementation":0,"productAcceptance":0,"reasons":[]},"schemaVersion":1,"stateRevision":4,"taskId":"review-pr-38-four-provider","updatedAt":"2026-08-10T10:37:35.180Z"}
