{"currentGate":null,"finalReview":null,"history":[{"planDigest":"54382279f2da5521bf4100e9d572aa11e59c4606ed7f53168c4261afa2b3c80a","planRevision":1,"recordedAt":"2026-08-07T23:13:08.077Z","type":"plan_synced"},{"planDigest":"ab5d6515fc9a021fa55929677d8fac5055c8203ba309b0a35df5bd191a4429ed","planRevision":2,"recordedAt":"2026-08-07T23:14:08.070Z","type":"plan_synced"}],"latestAdvice":null,"milestones":[{"evidenceGap":false,"evidenceRefs":[],"id":"M1","majorRisk":false,"pmReview":null,"pmVerdict":null,"reviewStale":false,"status":"not_started","title":"Final user deliverable","userAcceptance":null,"weight":100}],"nextAction":"Implement M1: Final user deliverable","planDigest":"ab5d6515fc9a021fa55929677d8fac5055c8203ba309b0a35df5bd191a4429ed","planRevision":2,"progress":{"health":"green","implementation":0,"productAcceptance":0,"reasons":[]},"schemaVersion":1,"stateRevision":2,"taskId":"fix-ccg-web-preview-invocation","updatedAt":"2026-08-07T23:14:08.072Z"}
